Enter password: *******
Welcome to the MySQL monitor.  Commands end with ; or \g.
Your MySQL connection id is 41
Server version: 8.0.41 MySQL Community Server - GPL

Copyright (c) 2000, 2025, Oracle and/or its affiliates.

Oracle is a registered trademark of Oracle Corporation and/or its
affiliates. Other names may be trademarks of their respective
owners.

Type 'help;' or '\h' for help. Type '\c' to clear the current input statement.

mysql> use unik;
Database changed

***************************************************************************************************
1. Declare local variables a, b, c, d and calculate the value of the expression
a < operator> b < operator> c < operator> d
where < operator> takes values from the set {+, -, *} in two ways:
- using the SET command;
- without using the SET command.
***************************************************************************************************
******** - without using the SET command.   ********
mysql> select  @a := 10, @b := 5, @c := 2, @d := 3, @a + @b * @c - @d;
+----------+---------+---------+---------+-------------------+
| @a := 10 | @b := 5 | @c := 2 | @d := 3 | @a + @b * @c - @d |
+----------+---------+---------+---------+-------------------+
|       10 |       5 |       2 |       3 |                17 |
+----------+---------+---------+---------+-------------------+
1 row in set, 4 warnings (0.00 sec)


******** - using the SET command;    ********

mysql> set @a = 10;
Query OK, 0 rows affected (0.00 sec)

mysql> set @b = 5;
Query OK, 0 rows affected (0.00 sec)

mysql> set @c = 2;
Query OK, 0 rows affected (0.00 sec)

mysql> set @d = 4;
Query OK, 0 rows affected (0.00 sec)

mysql> select @a+@b*@c-@d;
+-------------+
| @a+@b*@c-@d |
+-------------+
|          16 |
+-------------+
1 row in set (0.00 sec)

mysql>
mysql>
mysql>
mysql>
mysql>

***************************************************************************************************
2. Number the rows in the table and display every fifth row (for example, for a prize
draw).

2. Пронумерувати рядки в таблиці та вивести на екран кожен п’ятий рядок
(наприклад, для розіграшу призів).
***************************************************************************************************

mysql> set @i = 0;
Query OK, 0 rows affected (0.00 sec)

mysql> select @i as i, t.* from facultylist t where (@i := @i + 1) % 5 = 0;
+------+---------+-----------+--------+-----------------------+
| i    | Faculty | Specialty | Group  | Discipline            |
+------+---------+-----------+--------+-----------------------+
|    5 | FM      | CS        | Group1 | Geography             |
|   10 | f2      | s2        | Group2 | Chemistry             |
|   15 | f2      | s2        | Group2 | Environmental Science |
|   20 | f3      | s3        | Group3 | Economics             |
|   25 | f4      | s4        | Group4 | Chemistry             |
|   30 | f4      | s4        | Group4 | Statistics            |
|   35 | f5      | s5        | Group5 | Psychology            |
+------+---------+-----------+--------+-----------------------+
7 rows in set, 1 warning (0.00 sec)

mysql> set @i = 0;
Query OK, 0 rows affected (0.00 sec)

mysql>
mysql> select @i := @i+1 as `index`, t.* from facultylist t;
+-------+---------+-----------+--------+-------------------------+
| index | Faculty | Specialty | Group  | Discipline              |
+-------+---------+-----------+--------+-------------------------+
|     1 | FM      | CS        | Group1 | Mathematics             |
|     2 | FM      | CS        | Group1 | Physics                 |
|     3 | FM      | CS        | Group1 | Computer Science        |
|     4 | FM      | CS        | Group1 | Philosophy              |
|     5 | FM      | CS        | Group1 | Geography               |
|     6 | FM      | CS        | Group1 | Engineering Mechanics   |
|     7 | FM      | CS        | Group1 | Business Administration |
|     8 | FM      | CS        | Group1 | Medicine                |
|     9 | f2      | s2        | Group2 | Mathematics             |
|    10 | f2      | s2        | Group2 | Chemistry               |
|    11 | f2      | s2        | Group2 | English Literature      |
|    12 | f2      | s2        | Group2 | Economics               |
|    13 | f2      | s2        | Group2 | Sociology               |
|    14 | f2      | s2        | Group2 | Political Science       |
|    15 | f2      | s2        | Group2 | Environmental Science   |
|    16 | f2      | s2        | Group2 | Law                     |
|    17 | f3      | s3        | Group3 | Physics                 |
|    18 | f3      | s3        | Group3 | Biology                 |
|    19 | f3      | s3        | Group3 | History                 |
|    20 | f3      | s3        | Group3 | Economics               |
|    21 | f3      | s3        | Group3 | Sociology               |
|    22 | f3      | s3        | Group3 | Engineering Mechanics   |
|    23 | f3      | s3        | Group3 | Environmental Science   |
|    24 | f3      | s3        | Group3 | Art History             |
|    25 | f4      | s4        | Group4 | Chemistry               |
|    26 | f4      | s4        | Group4 | Computer Science        |
|    27 | f4      | s4        | Group4 | History                 |
|    28 | f4      | s4        | Group4 | Psychology              |
|    29 | f4      | s4        | Group4 | Political Science       |
|    30 | f4      | s4        | Group4 | Statistics              |
|    31 | f4      | s4        | Group4 | Law                     |
|    32 | f5      | s5        | Group5 | Biology                 |
|    33 | f5      | s5        | Group5 | English Literature      |
|    34 | f5      | s5        | Group5 | Philosophy              |
|    35 | f5      | s5        | Group5 | Psychology              |
|    36 | f5      | s5        | Group5 | Geography               |
|    37 | f5      | s5        | Group5 | Statistics              |
|    38 | f5      | s5        | Group5 | Business Administration |
|    39 | f5      | s5        | Group5 | Medicine                |
+-------+---------+-----------+--------+-------------------------+
39 rows in set, 1 warning (0.00 sec)

mysql>
mysql>
mysql>
mysql>

***************************************************************************************************
3. Create an event that calls a certain procedure at some point in time

3. Створити подію, яка викликає процедуру, створену в попередній лабораторній
роботі, в певний момент часу.
***************************************************************************************************

mysql>
mysql> SET GLOBAL event_scheduler = ON;
Query OK, 0 rows affected (0.00 sec)

mysql> delimiter //
mysql> create procedure taskForMyEvent()
    -> begin
    -> insert into studentlist values(22, 'Ivent Processenko', 122, 1);
    -> end //
Query OK, 0 rows affected (0.00 sec)

mysql> delimiter ;
mysql> select * from studentlist order by id desc limit 3;
+----+-------------+------------+---------+
| ID | FullName    | RecordBook | GroupID |
+----+-------------+------------+---------+
| 21 | Maxim       |        121 |       1 |
| 20 | Tina Moore  |        120 |       3 |
| 19 | Steve Allen |        119 |       5 |
+----+-------------+------------+---------+
3 rows in set (0.00 sec)

mysql> create event myEvent
    -> on schedule at current_timestamp + interval 1 minute
    -> do call taskForMyEvent();
Query OK, 0 rows affected (0.00 sec)

mysql> select * from studentlist order by id desc limit 3;
+----+-------------------+------------+---------+
| ID | FullName          | RecordBook | GroupID |
+----+-------------------+------------+---------+
| 22 | Ivent Processenko |        122 |       1 |
| 21 | Maxim             |        121 |       1 |
| 20 | Tina Moore        |        120 |       3 |
+----+-------------------+------------+---------+
3 rows in set (0.00 sec)


***************************************************************************************************
а тут я додаю в таблицю застарілі дані які буде оброблять івент
самих insertів тут нема бо я їх з другого терміналу вписував
***************************************************************************************************

mysql>
mysql>
mysql>
mysql> select * from creditlist;
+----------+-----------+--------------+------------+------+
| Semester | StudentID | DisciplineID | Date       | Mark |
+----------+-----------+--------------+------------+------+
|        1 |         1 |            1 | 2023-01-15 | NULL |
|        1 |         1 |            2 | 2023-01-15 | NULL |
|        1 |         2 |            1 | 2023-02-20 | NULL |
|        1 |         2 |            3 | 2023-02-20 |   83 |
|        1 |         3 |            4 | 2023-03-05 |   70 |
|        1 |         3 |            5 | 2023-03-05 |   88 |
|        1 |         4 |            2 | 2023-04-12 | NULL |
|        1 |         4 |            6 | 2023-04-12 |   94 |
|        1 |         5 |            7 | 2023-05-01 |   85 |
|        1 |         5 |            8 | 2023-05-01 |   75 |
|        1 |         6 |            9 | 2023-06-10 |   80 |
|        1 |         6 |           10 | 2023-06-10 |   67 |
|        1 |         7 |           11 | 2023-07-15 |   77 |
|        2 |         8 |            3 | 2023-09-05 |   82 |
|        2 |         8 |            5 | 2023-09-05 |   79 |
|        2 |         9 |            4 | 2023-10-10 |   66 |
|        2 |         9 |           12 | 2023-10-10 |   95 |
|        2 |        10 |            6 | 2023-11-01 |   89 |
|        2 |        10 |           13 | 2023-11-01 |   90 |
|        2 |        11 |            7 | 2023-12-12 |   92 |
|        2 |        11 |           14 | 2023-12-12 |   84 |
|        2 |        12 |            8 | 2024-01-10 |   80 |
|        2 |        12 |           15 | 2024-01-10 |   78 |
|        2 |        13 |            5 | 2024-02-25 |   92 |
|        2 |        13 |            9 | 2024-02-25 |   86 |
|        2 |        14 |            1 | 2024-03-15 |   72 |
|        2 |        14 |           16 | 2024-03-15 |   80 |
|        3 |        15 |            3 | 2024-04-20 |   88 |
|        3 |        15 |           18 | 2024-04-20 |   91 |
|        3 |        16 |            4 | 2024-05-30 |   75 |
|        3 |        16 |           17 | 2024-05-30 |   85 |
|        3 |        17 |            2 | 2024-06-25 |   89 |
|        3 |        17 |           19 | 2024-06-25 |   90 |
|        3 |        18 |           11 | 2024-07-18 |   79 |
|        3 |        18 |           20 | 2024-07-18 |   91 |
|        3 |        19 |            5 | 2024-08-10 |   92 |
|        3 |        19 |           20 | 2024-08-10 |   84 |
|        3 |        20 |           10 | 2024-09-01 |   78 |
|        3 |        20 |           13 | 2024-09-01 |   91 |
+----------+-----------+--------------+------------+------+
39 rows in set (0.00 sec)

mysql> select * from creditlist;
+----------+-----------+--------------+------------+------+
| Semester | StudentID | DisciplineID | Date       | Mark |
+----------+-----------+--------------+------------+------+
|        1 |         1 |            1 | 2023-01-15 | NULL |
|        1 |         1 |            2 | 2023-01-15 | NULL |
|        1 |         2 |            1 | 2023-02-20 | NULL |
|        1 |         2 |            3 | 2023-02-20 |   83 |
|        1 |         3 |            4 | 2023-03-05 |   70 |
|        1 |         3 |            5 | 2023-03-05 |   88 |
|        1 |         4 |            2 | 2023-04-12 | NULL |
|        1 |         4 |            6 | 2023-04-12 |   94 |
|        1 |         5 |            7 | 2023-05-01 |   85 |
|        1 |         5 |            8 | 2023-05-01 |   75 |
|        1 |         6 |            9 | 2023-06-10 |   80 |
|        1 |         6 |           10 | 2023-06-10 |   67 |
|        1 |         7 |           11 | 2023-07-15 |   77 |
|        2 |         8 |            3 | 2023-09-05 |   82 |
|        2 |         8 |            5 | 2023-09-05 |   79 |
|        2 |         9 |            4 | 2023-10-10 |   66 |
|        2 |         9 |           12 | 2023-10-10 |   95 |
|        2 |        10 |            6 | 2023-11-01 |   89 |
|        2 |        10 |           13 | 2023-11-01 |   90 |
|        2 |        11 |            7 | 2023-12-12 |   92 |
|        2 |        11 |           14 | 2023-12-12 |   84 |
|        2 |        12 |            8 | 2024-01-10 |   80 |
|        2 |        12 |           15 | 2024-01-10 |   78 |
|        2 |        13 |            5 | 2024-02-25 |   92 |
|        2 |        13 |            9 | 2024-02-25 |   86 |
|        2 |        14 |            1 | 2024-03-15 |   72 |
|        2 |        14 |           16 | 2024-03-15 |   80 |
|        3 |        15 |            3 | 2024-04-20 |   88 |
|        3 |        15 |           18 | 2024-04-20 |   91 |
|        3 |        16 |            4 | 2024-05-30 |   75 |
|        3 |        16 |           17 | 2024-05-30 |   85 |
|        3 |        17 |            2 | 2024-06-25 |   89 |
|        3 |        17 |           19 | 2024-06-25 |   90 |
|        3 |        18 |           11 | 2024-07-18 |   79 |
|        3 |        18 |           20 | 2024-07-18 |   91 |
|        3 |        19 |            5 | 2024-08-10 |   92 |
|        3 |        19 |           20 | 2024-08-10 |   84 |
|        3 |        20 |           10 | 2024-09-01 |   78 |
|        3 |        20 |           13 | 2024-09-01 |   91 |
|        4 |        11 |           14 | 2018-03-22 |   87 |
|        4 |        19 |           18 | 2019-08-30 |   82 |
|        5 |         1 |           19 | 2018-12-14 |   88 |
|        5 |        12 |           15 | 2019-05-11 |   91 |
|        6 |        14 |           16 | 2020-04-18 |   78 |
|        6 |        18 |           20 | 2021-03-03 |   93 |
|        7 |        16 |           17 | 2021-06-09 |   85 |
|        7 |        20 |           13 | 2019-07-01 |   79 |
|        8 |        13 |            9 | 2020-11-25 |   76 |
|        8 |        15 |           18 | 2020-10-20 |   89 |
+----------+-----------+--------------+------------+------+
49 rows in set (0.00 sec)

mysql> show tables;
+----------------------------------+
| Tables_in_unik                   |
+----------------------------------+
| credit of passing the discipline |
| creditlist                       |
| debts                            |
| discipline                       |
| discipline_has_specialty         |
| disciplinelist                   |
| faculty                          |
| facultylist                      |
| group                            |
| phone number                     |
| specialty                        |
| student                          |
| student_has_discipline           |
| studenthourload                  |
| studentlist                      |
+----------------------------------+
15 rows in set (0.00 sec)


***************************************************************************************************
4. Create an archive table (using the like specifier to copy an existing table) and an
event that moves outdated data to the archive.

4. Створити архівну таблицю (використовуючи специфікатор like для
копіювання вже існуючої таблиці) та подію, яка переміщує застарілі дані в архів.
***************************************************************************************************


mysql> create table `archiveCredits` like `credit of passing the discipline`;
Query OK, 0 rows affected (0.03 sec)

mysql>
mysql>
mysql> delimiter //
mysql> create event archiveCredits
    -> on schedule every 1 week starts CURRENT_TIMESTAMP + interval 2 minute
    -> do begin
    -> insert into archiveCredits select * from `credit of passing the discipline`
    -> where `date of passing` < NOW() - INTERVAL 4 year;
    ->
    -> delete from `credit of passing the discipline`
    -> where `date of passing` < NOW() - INTERVAL 4 year;
    -> end;
    -> //
Query OK, 0 rows affected (0.00 sec)

mysql> select * from creditlist;
    -> //
+----------+-----------+--------------+------------+------+
| Semester | StudentID | DisciplineID | Date       | Mark |
+----------+-----------+--------------+------------+------+
|        1 |         1 |            1 | 2023-01-15 | NULL |
|        1 |         1 |            2 | 2023-01-15 | NULL |
|        1 |         2 |            1 | 2023-02-20 | NULL |
|        1 |         2 |            3 | 2023-02-20 |   83 |
|        1 |         3 |            4 | 2023-03-05 |   70 |
|        1 |         3 |            5 | 2023-03-05 |   88 |
|        1 |         4 |            2 | 2023-04-12 | NULL |
|        1 |         4 |            6 | 2023-04-12 |   94 |
|        1 |         5 |            7 | 2023-05-01 |   85 |
|        1 |         5 |            8 | 2023-05-01 |   75 |
|        1 |         6 |            9 | 2023-06-10 |   80 |
|        1 |         6 |           10 | 2023-06-10 |   67 |
|        1 |         7 |           11 | 2023-07-15 |   77 |
|        2 |         8 |            3 | 2023-09-05 |   82 |
|        2 |         8 |            5 | 2023-09-05 |   79 |
|        2 |         9 |            4 | 2023-10-10 |   66 |
|        2 |         9 |           12 | 2023-10-10 |   95 |
|        2 |        10 |            6 | 2023-11-01 |   89 |
|        2 |        10 |           13 | 2023-11-01 |   90 |
|        2 |        11 |            7 | 2023-12-12 |   92 |
|        2 |        11 |           14 | 2023-12-12 |   84 |
|        2 |        12 |            8 | 2024-01-10 |   80 |
|        2 |        12 |           15 | 2024-01-10 |   78 |
|        2 |        13 |            5 | 2024-02-25 |   92 |
|        2 |        13 |            9 | 2024-02-25 |   86 |
|        2 |        14 |            1 | 2024-03-15 |   72 |
|        2 |        14 |           16 | 2024-03-15 |   80 |
|        3 |        15 |            3 | 2024-04-20 |   88 |
|        3 |        15 |           18 | 2024-04-20 |   91 |
|        3 |        16 |            4 | 2024-05-30 |   75 |
|        3 |        16 |           17 | 2024-05-30 |   85 |
|        3 |        17 |            2 | 2024-06-25 |   89 |
|        3 |        17 |           19 | 2024-06-25 |   90 |
|        3 |        18 |           11 | 2024-07-18 |   79 |
|        3 |        18 |           20 | 2024-07-18 |   91 |
|        3 |        19 |            5 | 2024-08-10 |   92 |
|        3 |        19 |           20 | 2024-08-10 |   84 |
|        3 |        20 |           10 | 2024-09-01 |   78 |
|        3 |        20 |           13 | 2024-09-01 |   91 |
|        4 |        11 |           14 | 2018-03-22 |   87 |
|        4 |        19 |           18 | 2019-08-30 |   82 |
|        5 |         1 |           19 | 2018-12-14 |   88 |
|        5 |        12 |           15 | 2019-05-11 |   91 |
|        6 |        14 |           16 | 2020-04-18 |   78 |
|        6 |        18 |           20 | 2021-03-03 |   93 |
|        7 |        16 |           17 | 2021-06-09 |   85 |
|        7 |        20 |           13 | 2019-07-01 |   79 |
|        8 |        13 |            9 | 2020-11-25 |   76 |
|        8 |        15 |           18 | 2020-10-20 |   89 |
+----------+-----------+--------------+------------+------+
49 rows in set (0.00 sec)

mysql> select * from creditlist where date  < NOW() - INTERVAL 4 year;
    -> //
+----------+-----------+--------------+------------+------+
| Semester | StudentID | DisciplineID | Date       | Mark |
+----------+-----------+--------------+------------+------+
|        4 |        11 |           14 | 2018-03-22 |   87 |
|        4 |        19 |           18 | 2019-08-30 |   82 |
|        5 |         1 |           19 | 2018-12-14 |   88 |
|        5 |        12 |           15 | 2019-05-11 |   91 |
|        6 |        14 |           16 | 2020-04-18 |   78 |
|        6 |        18 |           20 | 2021-03-03 |   93 |
|        7 |        20 |           13 | 2019-07-01 |   79 |
|        8 |        13 |            9 | 2020-11-25 |   76 |
|        8 |        15 |           18 | 2020-10-20 |   89 |
+----------+-----------+--------------+------------+------+
9 rows in set (0.00 sec)

mysql> select * from creditlist where date  < NOW() - INTERVAL 4 year;//
Empty set (0.00 sec)

mysql> select * from creditlist;//
+----------+-----------+--------------+------------+------+
| Semester | StudentID | DisciplineID | Date       | Mark |
+----------+-----------+--------------+------------+------+
|        1 |         1 |            1 | 2023-01-15 | NULL |
|        1 |         1 |            2 | 2023-01-15 | NULL |
|        1 |         2 |            1 | 2023-02-20 | NULL |
|        1 |         2 |            3 | 2023-02-20 |   83 |
|        1 |         3 |            4 | 2023-03-05 |   70 |
|        1 |         3 |            5 | 2023-03-05 |   88 |
|        1 |         4 |            2 | 2023-04-12 | NULL |
|        1 |         4 |            6 | 2023-04-12 |   94 |
|        1 |         5 |            7 | 2023-05-01 |   85 |
|        1 |         5 |            8 | 2023-05-01 |   75 |
|        1 |         6 |            9 | 2023-06-10 |   80 |
|        1 |         6 |           10 | 2023-06-10 |   67 |
|        1 |         7 |           11 | 2023-07-15 |   77 |
|        2 |         8 |            3 | 2023-09-05 |   82 |
|        2 |         8 |            5 | 2023-09-05 |   79 |
|        2 |         9 |            4 | 2023-10-10 |   66 |
|        2 |         9 |           12 | 2023-10-10 |   95 |
|        2 |        10 |            6 | 2023-11-01 |   89 |
|        2 |        10 |           13 | 2023-11-01 |   90 |
|        2 |        11 |            7 | 2023-12-12 |   92 |
|        2 |        11 |           14 | 2023-12-12 |   84 |
|        2 |        12 |            8 | 2024-01-10 |   80 |
|        2 |        12 |           15 | 2024-01-10 |   78 |
|        2 |        13 |            5 | 2024-02-25 |   92 |
|        2 |        13 |            9 | 2024-02-25 |   86 |
|        2 |        14 |            1 | 2024-03-15 |   72 |
|        2 |        14 |           16 | 2024-03-15 |   80 |
|        3 |        15 |            3 | 2024-04-20 |   88 |
|        3 |        15 |           18 | 2024-04-20 |   91 |
|        3 |        16 |            4 | 2024-05-30 |   75 |
|        3 |        16 |           17 | 2024-05-30 |   85 |
|        3 |        17 |            2 | 2024-06-25 |   89 |
|        3 |        17 |           19 | 2024-06-25 |   90 |
|        3 |        18 |           11 | 2024-07-18 |   79 |
|        3 |        18 |           20 | 2024-07-18 |   91 |
|        3 |        19 |            5 | 2024-08-10 |   92 |
|        3 |        19 |           20 | 2024-08-10 |   84 |
|        3 |        20 |           10 | 2024-09-01 |   78 |
|        3 |        20 |           13 | 2024-09-01 |   91 |
|        7 |        16 |           17 | 2021-06-09 |   85 |
+----------+-----------+--------------+------------+------+
40 rows in set (0.00 sec)

mysql> select * from archiveCredits;
    -> //
+----------+------------------------------------------+-------------------------------------------------+-----------------+------+----------------+
| Semester | Student_has_Discipline_Student_StudentID | Student_has_Discipline_Discipline_Discipline ID | date of passing | mark | teacher's name |
+----------+------------------------------------------+-------------------------------------------------+-----------------+------+----------------+
|        4 |                                       11 |                                              14 | 2018-03-22      |   87 | NULL           |
|        4 |                                       19 |                                              18 | 2019-08-30      |   82 | NULL           |
|        5 |                                        1 |                                              19 | 2018-12-14      |   88 | NULL           |
|        5 |                                       12 |                                              15 | 2019-05-11      |   91 | NULL           |
|        6 |                                       14 |                                              16 | 2020-04-18      |   78 | NULL           |
|        6 |                                       18 |                                              20 | 2021-03-03      |   93 | NULL           |
|        7 |                                       20 |                                              13 | 2019-07-01      |   79 | NULL           |
|        8 |                                       13 |                                               9 | 2020-11-25      |   76 | NULL           |
|        8 |                                       15 |                                              18 | 2020-10-20      |   89 | NULL           |
+----------+------------------------------------------+-------------------------------------------------+-----------------+------+----------------+
9 rows in set (0.00 sec)

mysql> delimiter ;
mysql>
